URL|מילות מפתח
https://loan-israel.co.il/הלוואה-מימון-לרכב-שטח/|הלוואה לרכב שטח, מימון רכב שטח, רכב שטח, הלוואת רכב
https://loan-israel.co.il/ליסינג-תפעולי/|ליסינג תפעולי, ליסינג, חכירה תפעולית
https://loan-israel.co.il/מסלולי-הלוואות-לכל-מטרה-של-בנק-הפועלים/|הלוואה בנק הפועלים, בנק הפועלים, מסלולי הלוואות הפועלים
https://loan-israel.co.il/מסלולי-הלוואות-לכל-מטרה-של-בנק-פועלי-אג/|הלוואה בנק פאגי, בנק פאגי, פועלי אגודת ישראל
https://loan-israel.co.il/מסלולי-הלוואות-לכל-מטרה-של-בנק-ירושלים/|הלוואה בנק ירושלים, בנק ירושלים, מסלולי הלוואות ירושלים
https://loan-israel.co.il/הדרך-לאתור-חשבונות-מוגבלים/|בדיקת חשבון מוגבל, חשבון מוגבל, חשבון בנק מוגבל
https://loan-israel.co.il/fixed-loans/|הלוואה עומדת, תנאים מועדפים, בדיקת זכאות
https://loan-israel.co.il/הלוואה-מחברה-פרטית/|הלוואות פרטיות, אישור מיידי, ריבית נמוכה, הלוואה פרטית
https://loan-israel.co.il/חוק-הפקדת-מזומן-בבנק/|חוק הפקדת מזומן, הפקדת מזומן בבנק, חוק כספי
https://loan-israel.co.il/מסלולי-הלוואות-לכל-מטרה-של-בנק-מזרחי-טפ/|הלוואה בנק מזרחי, בנק מזרחי טפחות, מסלולי הלוואות מזרחי
https://loan-israel.co.il/מימון-לרכב-מסחרי-2/|מימון רכב מסחרי, רכב מסחרי, הלוואת רכב מסחרי
https://loan-israel.co.il/בנק-one-zero-מדריך-שלם-לפתיחת-חשבון/|בנק ONE ZERO, וואן זירו, פתיחת חשבון בנק
https://loan-israel.co.il/מסלולי-הלוואות-לכל-מטרה-של-בנק-אוצר-החי/|הלוואה בנק אוצר החייל, בנק אוצר החייל, מסלולי הלוואות אוצר החייל
https://loan-israel.co.il/מימון-לרכב-חדש/|מימון רכב חדש, הלוואת רכב חדש, רכב חדש
https://loan-israel.co.il/ליסינג-לרכב-יד-שנייה/|ליסינג רכב יד שנייה, רכב יד שנייה, ליסינג משומש
https://loan-israel.co.il/מימון-לרכב-למסורבים-בבנק/|מימון רכב למסורבים, רכב למסורבים, הלוואת רכב למסורבים
https://loan-israel.co.il/מרכנתיל-פתיחת-חשבון-עסקי/|מרכנתיל חשבון עסקי, בנק מרכנתיל, חשבון עסקי
https://loan-israel.co.il/הלוואה-מימון-לרכב-הסעות/|מימון רכב הסעות, רכב הסעות, הלוואת רכב הסעות
https://loan-israel.co.il/הלוואות-לבעלי-bdi-שלילי/|הלוואות BDI שלילי, BDI שלילי, דירוג אשראי שלילי
https://loan-israel.co.il/יתרנות-וחסרונות-בלקיחת-הלוואה-מהבנק-ל/|הלוואה מהבנק, הלוואה חוץ בנקאית, השוואת הלוואות
https://loan-israel.co.il/הלוואה-מביטוח-לאומי-על-חשבון-קצבה/|הלוואה מביטוח לאומי, למוגבלים, קצבת ביטוח לאומי
https://loan-israel.co.il/הלוואות-מקופת-גמל/|הלוואות מקופת גמל, קופת גמל, הלוואה כנגד גמל
https://loan-israel.co.il/כל-מה-שצריך-לדעת-על-דמי-ניהול-בחשבון-הבנ/|דמי ניהול בנק, דמי ניהול, חיסכון בדמי ניהול
https://loan-israel.co.il/הלוואה-עד-80000-שח/|הלוואה 80000, הלוואה עד 80 אלף
https://loan-israel.co.il/הלוואות-גישור-לכל-מטרה/|הלוואות גישור, הלוואת גישור, מימון גישור
https://loan-israel.co.il/הלוואות-ללא-כרטיס-אשראי/|הלוואות ללא כרטיס אשראי, בלי כרטיס אשראי
https://loan-israel.co.il/הלוואות-בנקאיות-ללקוחות-כל-הבנקים/|הלוואות בנקאיות, כל הבנקים, הלוואה בנקאית
https://loan-israel.co.il/הלוואות-אקספרס/|הלוואות אקספרס, הלוואה מהירה, אישור מיידי
https://loan-israel.co.il/הלוואות-גישור/|הלוואות גישור לדירה, גישור, רכישת דירה
https://loan-israel.co.il/הלוואה-עד-150-אלף-שח/|הלוואה 150 אלף, הלוואה עד 150000
https://loan-israel.co.il/חוק-הלוואות-חוץ-בנקאיות-אשראי-הוגן/|חוק אשראי הוגן, הלוואות חוץ בנקאיות, חוק הלוואות
https://loan-israel.co.il/הלוואה-עד-40000-שח/|הלוואה 40000, הלוואה עד 40 אלף
https://loan-israel.co.il/מסלולי-הלוואות-למימון-רכב-של-בנק-מסד/|מימון רכב בנק מסד, בנק מסד, הלוואת רכב מסד
https://loan-israel.co.il/מסלולי-הלוואות-למימון-רכב-של-בנק-ירושל/|מימון רכב בנק ירושלים, בנק ירושלים רכב
https://loan-israel.co.il/מסלולי-הלוואות-למימון-רכב-של-בנק-הפועל/|מימון רכב בנק הפועלים, בנק הפועלים רכב
https://loan-israel.co.il/הלוואות-קטנות/|הלוואות קטנות, הלוואה קטנה, מימון קטן
https://loan-israel.co.il/הלוואה-עד-300-אלף-שח/|הלוואה 300 אלף, הלוואה עד 300000
https://loan-israel.co.il/הלוואה-עד-60000-שח/|הלוואה 60000, הלוואה עד 60 אלף
https://loan-israel.co.il/הלוואה-עד-400-אלף-שח/|הלוואה 400 אלף, הלוואה עד 400000
https://loan-israel.co.il/האגודה-הישראלית-להלוואות-ללא-ריבית/|עוגן, הלוואות ללא ריבית, ריבית אפס
https://loan-israel.co.il/הלוואה-עד-90000-שח/|הלוואה 90000, הלוואה עד 90 אלף
https://loan-israel.co.il/חשבון-בנק-באינטרנט-יתרונות-וחסרונות/|חשבון בנק באינטרנט, בנק דיגיטלי, בנקאות מקוונת
https://loan-israel.co.il/הלוואות-לפושטי-רגל/|הלוואות לפושטי רגל, פושט רגל, חדלות פירעון
https://loan-israel.co.il/מסלולי-הלוואות-לכל-מטרה-של-בנק-דיסקונט/|הלוואה בנק דיסקונט, בנק דיסקונט, מסלולי הלוואות דיסקונט
https://loan-israel.co.il/הלוואות-מימון-לאופנוע-חדש-או-יד-שנייה/|מימון אופנוע, הלוואת אופנוע, אופנוע חדש
https://loan-israel.co.il/מחשבון-פנסיה-מתקדם/|מחשבון פנסיה, חישוב פנסיה, תכנון פנסיוני
https://loan-israel.co.il/הלוואות-למקבלי-קצבאות/|הלוואות למקבלי קצבאות, קצבאות, גמלאים
https://loan-israel.co.il/balloon-loans/|הלוואות בלון, הלוואת בלון, מימון בלון
https://loan-israel.co.il/הלוואות-בכרטיס-אשראי/|הלוואות בכרטיס אשראי, כרטיס אשראי, משיכת אשראי
https://loan-israel.co.il/מחשבון-משכנתא-מתקדם/|מחשבון משכנתא, חישוב משכנתא, תכנון משכנתא
https://loan-israel.co.il/מחשבון-ריבית-דה-ריבית/|מחשבון ריבית דריבית, ריבית דריבית, חישוב ריבית
https://loan-israel.co.il/מחשבון-חיסכון-מתקדם/|מחשבון חיסכון, חישוב חיסכון, תכנון חיסכון
https://loan-israel.co.il/civil-servants-loans/|הלוואות לעובדי מדינה, עובדי מדינה, שירות מדינה
https://loan-israel.co.il/property-loans/|הלוואה כנגד נכס, הלוואת נכס, משכון נכס
https://loan-israel.co.il/הלוואות-מחברות-ביטוח/|הלוואות מחברות ביטוח, חברת ביטוח, מימון מביטוח
https://loan-israel.co.il/הלוואה-להשלמת-הון-עצמי-לדירה/|השלמת הון עצמי, הון עצמי לדירה, רכישת דירה
https://loan-israel.co.il/מחשבון-הלוואות-מתקדם/|מחשבון הלוואות, חישוב הלוואה, תכנון הלוואה
https://loan-israel.co.il/מיחזור-הלוואה/|מיחזור הלוואה, מחזור הלוואה, ארגון חוב
https://loan-israel.co.il/הלוואה-מקרן-השתלמות/|הלוואה מקרן השתלמות, קרן השתלמות, משיכת קרן
https://loan-israel.co.il/הלוואה-עד-5000-שח/|הלוואה 5000, הלוואה עד 5 אלף
https://loan-israel.co.il/איך-לקבל-הלוואה-באינטרנט-ב-5-דקות/|הלוואות אונליין, הלוואה באינטרנט, הלוואה מהירה
https://loan-israel.co.il/יועץ-הלוואות/|יועץ הלוואות, ייעוץ הלוואות, ייעוץ פיננסי
https://loan-israel.co.il/renovation-loans/|הלוואה לשיפוץ, שיפוץ דירה, הלוואת שיפוץ
https://loan-israel.co.il/הלוואה-עד-70000-שח/|הלוואה 70000, הלוואה עד 70 אלף
https://loan-israel.co.il/הלוואות-לגימלאים/|הלוואות לגימלאים, גימלאים, גמלאי צהל
https://loan-israel.co.il/הלוואות-לטווח-קצר/|הלוואות לטווח קצר, הלוואה קצרה, מימון לטווח קצר
https://loan-israel.co.il/instant-loan/|הלוואה מיידית, אישור מיידי, הלוואה תוך דקות
https://loan-israel.co.il/הלוואות-על-חשבון-הפנסיה/|הלוואה מהפנסיה, הלוואה על חשבון פנסיה, משיכת פנסיה
https://loan-israel.co.il/checks-loans/|הלוואה בצקים, הלוואת צקים, צקים
https://loan-israel.co.il/הלוואה-מיידית-אונליין/|הלוואה דיגיטלית, הלוואה אונליין, אישור אונליין
https://loan-israel.co.il/rejected-loans/|הלוואה למסורבים, מסורבים, נדחו בבנק
https://loan-israel.co.il/non-bank-loan/|הלוואה חוץ בנקאית, חוץ בנקאית, לא מהבנק
https://loan-israel.co.il/הלוואות-ללא-ריבית/|הלוואה ללא ריבית, ריבית אפס, בלי ריבית
https://loan-israel.co.il/employees-loans/|הלוואה לשכירים, שכירים, עובדים שכירים
https://loan-israel.co.il/מסלולי-הלוואות-למימון-רכב-השוואת-בנקי/|השוואת בנקים רכב, מימון רכב השוואה, בחירת בנק
https://loan-israel.co.il/מסלולי-הלוואות-לכל-מטרה-של-בנק-מרכנתיל/|הלוואה בנק מרכנתיל, בנק מרכנתיל, מסלולי הלוואות מרכנתיל
https://loan-israel.co.il/דחיית-תשלום-הלוואה/|דחיית תשלום, דחיית פרעון, ארכה בתשלום
https://loan-israel.co.il/הלוואה-עד-500-אלף-שח/|הלוואה 500 אלף, הלוואה עד 500000
https://loan-israel.co.il/הלוואות-חברתיות/|הלוואות חברתיות, מימון המונים, הלוואת עמיתים
https://loan-israel.co.il/הלוואות-גדולות-2/|הלוואות גדולות, הלוואה גדולה, מימון גדול
https://loan-israel.co.il/אובליגו/|אובליגו, הלוואות לעסקים, מסגרת אשראי
https://loan-israel.co.il/בדיקת-דירוג-אשראי-אישי/|בדיקת דירוג אשראי, דירוג אשראי, ציון אשראי
https://loan-israel.co.il/prime-interest/|ריבית הפריים, פריים, ריבית בנק ישראל
https://loan-israel.co.il/השחקן-החדש-בתחום-ההלוואות-רמי-לוי/|רמי לוי הלוואות, רמי לוי, הלוואות רמי לוי
https://loan-israel.co.il/בקשת-הלוואה/|בקשת הלוואה, טופס הלוואה, הגשת בקשה
https://loan-israel.co.il/הלוואה-על-חשבון-קרן-השתלמות-אלטשולר-שח/|קרן השתלמות אלטשולר, אלטשולר שחם, משיכת קרן אלטשולר
https://loan-israel.co.il/הלוואה-כנגד-קופת-גמל-להשקעה/|הלוואה כנגד גמל, קופת גמל להשקעה, משכנתא על גמל
https://loan-israel.co.il/הלוואה-לדירה/|הלוואה לדירה, רכישת דירה, מימון דירה
https://loan-israel.co.il/הלוואה-עד-100-אלף-שח/|הלוואה 100 אלף, הלוואה עד 100000
https://loan-israel.co.il/הלוואות-למוגבלים-ומעוקלים/|הלוואות למוגבלים, מוגבלים, מעוקלים
https://loan-israel.co.il/הלוואות-בהוראת-קבע/|הלוואות בהוראת קבע, הוראת קבע, תשלום חודשי
https://loan-israel.co.il/הלוואות-למילואימניקים/|הלוואות למילואימניקים, מילואימניקים, משרתי מילואים
https://loan-israel.co.il/הלוואות-לגיל-השלישי-למקבלי-פנסיה-וקצב/|הלוואות לגיל השלישי, גיל שלישי, קשישים
https://loan-israel.co.il/הלוואה-בכרטיס-אשראי/|הלוואה מכרטיס אשראי, חברת כרטיסי אשראי, מקס
https://loan-israel.co.il/הלוואה-200-אלף-שח/|הלוואה 200 אלף, הלוואה עד 200000
https://loan-israel.co.il/הלוואות-להשקעה/|הלוואות להשקעה, מימון השקעה, השקעה
https://loan-israel.co.il/הלוואות-לעולים-חדשים/|הלוואות לעולים חדשים, עולים חדשים, עלייה
https://loan-israel.co.il/הלוואות-לנזקקים/|הלוואות לנזקקים, נזקקים, סיוע כלכלי
https://loan-israel.co.il/הלוואות-לאנשי-צבא-קבע/|הלוואות לאנשי צבא, צבא קבע, קבע, כוחות ביטחון
https://loan-israel.co.il/הלוואות-ללימודים-בחול/|הלוואות ללימודים בחול, לימודים בחול, השכלה גבוהה
https://loan-israel.co.il/קרן-הלוואות-ללא-ריבית/|קרן הלוואות, ללא ריבית, גמח
https://loan-israel.co.il/45/|הלוואות לחיילים משוחררים, חיילים משוחררים, משוחררים
https://loan-israel.co.il/חברת-הלוואות/|חברת הלוואות, חברה פיננסית, מלווה
https://loan-israel.co.il/הלוואות-לשוטרים/|הלוואות לשוטרים, שוטרים, משטרת ישראל
https://loan-israel.co.il/הלוואות-לרופאים/|הלוואות לרופאים, רופאים, רפואה
https://loan-israel.co.il/הלוואה-ללימודים/|הלוואה ללימודים, הלוואת לימודים, סטודנטים
https://loan-israel.co.il/הלוואות-לעובדי-קופח-כללית/|הלוואה עובדי כללית, קופת חולים כללית, כללית
https://loan-israel.co.il/הלוואה-עד-10000-₪/|הלוואה 10000, הלוואה עד 10 אלף
https://loan-israel.co.il/הלוואה-עד-20000-שח/|הלוואה 20000, הלוואה עד 20 אלף
https://loan-israel.co.il/הלוואות-לבעלי-דירוג-אשראי-נמוך/|דירוג אשראי נמוך, אשראי נמוך, ציון אשראי נמוך
https://loan-israel.co.il/הלוואות-למורים/|הלוואות למורים, מורים, עובדי הוראה
https://loan-israel.co.il/הלוואה-לחתונה/|הלוואה לחתונה, חתונה, מימון חתונה
https://loan-israel.co.il/הלוואות-שוק-אפור/|הלוואת שוק אפור, שוק אפור, מלווים פרטיים
https://loan-israel.co.il/הלוואה-עד-50000-שח/|הלוואה 50000, הלוואה עד 50 אלף
https://loan-israel.co.il/איך-להקטין-החזר-באיחוד-הלוואות/|איחוד הלוואות, איחוד חובות, מיחזור חוב
https://loan-israel.co.il/הלוואה-בריבית-נמוכה/|הלוואה בריבית נמוכה, ריבית נמוכה, מימון זול
https://loan-israel.co.il/הלוואות-לעובדי-עיריייה/|הלוואות לעובדי עירייה, עובדי עירייה, רשות מקומית
https://loan-israel.co.il/הלוואות-להליך-רפואי/|הלוואות להליך רפואי, הליך רפואי, טיפול רפואי
https://loan-israel.co.il/הלוואות-לחופשה-בחול-או-בארץ/|הלוואות לחופשה, חופשה בחול, טיולים
https://loan-israel.co.il/הלוואות-גדולות/|משכנתא, משכנתאות, הלוואת משכנתא
https://loan-israel.co.il/הלוואות-ללא-ערבים/|הלוואות ללא ערבים, בלי ערבים, ללא ערבויות
https://loan-israel.co.il/הלוואה-עד-30000-שח/|הלוואה 30000, הלוואה עד 30 אלף
https://loan-israel.co.il/משיכת-כספי-פנסיה-כל-מה-שעליכם-לדעת/|משיכת פנסיה, כספי פנסיה, יציאה לפנסיה
https://loan-israel.co.il/הלוואות-לסגירת-חובות/|הלוואות לסגירת חובות, סגירת חובות, ארגון חובות
https://loan-israel.co.il/Business/loans-for-new-business/|הלוואה לפתיחת עסק
https://loan-israel.co.il/Business/solo-loans-to-businesses/|הלוואות סולו לעסקים
https://loan-israel.co.il/Business/business-loan-difficulties/|הלוואה לעסקים בקשיים
https://loan-israel.co.il/Business/loans-for-start-up/|הלוואות לחברות סטארט אפ
https://loan-israel.co.il/Business/working-capital-loans-to-businesses/|הלוואות הון חוזר לעסקים
https://loan-israel.co.il/Business/redit-solutions-for-small-businesses/|פתרונות מימון ואשראי לעסקים קטנים
https://loan-israel.co.il/Business/private_buisiness_loan/|הלוואות פרטיות לעסקים
https://loan-israel.co.il/Business/business-credit-from-banks/|גיוס אשראי לעסקים מבנקים
https://loan-israel.co.il/Business/big-business-credit-recruitment/|גיוס אשראי לעסקים גדולים
https://loan-israel.co.il/Business/business-bridging-loan/|הלוואת גישור לעסקים
https://loan-israel.co.il/Business/loan-for-the-purchase-of-operating-business/|הלוואה לרכישת עסק פעיל, הלוואה לרכישת עסק
https://loan-israel.co.il/Business/%d7%9e%d7%a8%d7%95%d7%9d-%d7%94%d7%a7%d7%a8%d7%9f-%d7%9c%d7%94%d7%9c%d7%95%d7%95%d7%90%d7%95%d7%aa-%d7%9c%d7%a2%d7%a1%d7%a7%d7%99%d7%9d-%d7%a9%d7%9c-%d7%94%d7%a1%d7%95%d7%9b%d7%a0%d7%95%d7%aa-%d7%94/|קרן מרום, מרום הקרן להלוואות לעסקים של הסוכנות היהודית
https://loan-israel.co.il/Business/%d7%a7%d7%a8%d7%9f-%d7%9e%d7%a4%d7%a8%d7%a9-%d7%9c%d7%94%d7%9c%d7%95%d7%95%d7%90%d7%95%d7%aa-%d7%9c%d7%a2%d7%a1%d7%a7%d7%99%d7%9d/|קרן מפרש, קרן מפרש להלוואות לעסקים
https://loan-israel.co.il/Business/%d7%a7%d7%a8%d7%a0%d7%95%d7%aa-%d7%a4%d7%99%d7%9c%d7%a0%d7%aa%d7%a8%d7%95%d7%a4%d7%99%d7%95%d7%aa/|קרנות פילנתרופיות
https://loan-israel.co.il/Business/working-capital-loans/|הלוואות להון חוזר
https://loan-israel.co.il/Business/business-loan-construction/|הלוואה לעסק בהקמה
https://loan-israel.co.il/Business/israel-free-loan/|עוגן הלוואות
https://loan-israel.co.il/Business/business-assistance-fund-state-guarantee/|הקרן לסיוע לעסקים בערבות המדינה
https://loan-israel.co.il/Business/state-guarantee-fund-bdsk/|קרן BDSK בערבות המדינה
https://loan-israel.co.il/Business/%d7%a7%d7%a8%d7%9f-%d7%a7%d7%95%d7%a8%d7%aa/|קרן קורת
https://loan-israel.co.il/Business/venture-capital-funds/|קרן הון סיכון
https://loan-israel.co.il/Business/non-bank-loans-to-businesses/|הלוואה חוץ בנקאית לעסקים
https://loan-israel.co.il/Business/%d7%a7%d7%a8%d7%9f-%d7%a0%d7%a1-%d7%94%d7%a1%d7%95%d7%9b%d7%a0%d7%95%d7%aa-%d7%94%d7%99%d7%94%d7%95%d7%93%d7%99%d7%aa/|קרן נס, קרן נס הסוכנות היהודית
https://loan-israel.co.il/Business/solar-activity-financing-plan/|מימון לקולטים סולארים, תכנית מימון לפעילות סולארית
https://loan-israel.co.il/Business/the-new-fund-to-assist-small-and-medium-businesses/|הקרן החדשה לסיוע לעסקים קטנים ובינוניים
https://loan-israel.co.il/Business/loan-to-open-a-business/|הלוואה בערבות המדינה לפתיחת עסק
https://loan-israel.co.il/Business/%d7%a7%d7%a8%d7%9f-%d7%a0%d7%aa%d7%9f-%d7%a7%d7%99%d7%a8%d7%a9/|קרן נתן
https://loan-israel.co.il/Business/%d7%a7%d7%a8%d7%9f-%d7%a4%d7%93%d7%a8%d7%a6%d7%99%d7%99%d7%aa-%d7%a0%d7%99%d7%95-%d7%99%d7%95%d7%a8%d7%a7-%d7%9c%d7%99%d7%a9%d7%a8%d7%90%d7%9c/|קרן פדרציית ניו-יורק לישראל
https://loan-israel.co.il/Business/%d7%a7%d7%a8%d7%9f-%d7%a4%d7%99%d7%98%d7%a1%d7%91%d7%95%d7%a8%d7%92-%d7%9c%d7%a2%d7%a1%d7%a7%d7%99%d7%9d/|קרן פיטסבורג לעסקים
https://loan-israel.co.il/Business/state-guaranteed-loan-to-cover-the-obligo/|הלוואה בערבות מדינה לכיסוי אובליגו
https://loan-israel.co.il/Business/loans-to-businesses-of-bank-discont/|הלוואות לעסקים של בנק דיסקונט
https://loan-israel.co.il/Business/business-loans-routes-mizrahi-tefahot-bank/|הלוואות לעסקים של בנק מזרחי טפחות
https://loan-israel.co.il/Business/business-loans-routes-mercantile-discount-bank/|הלוואות לעסקים של בנק מרכנתיל דיסקונט
https://loan-israel.co.il/Business/solo-loans-without-collateral/|הלוואות סולו, הלוואות סולו ללא בטחונות
https://loan-israel.co.il/Business/self-employed-loans/|הלוואה לעצמאים בערבות המדינה
https://loan-israel.co.il/Business/%d7%a7%d7%a8%d7%9f-%d7%9c%d7%a1%d7%99%d7%95%d7%a2-%d7%9c%d7%a2%d7%a1%d7%a7%d7%99%d7%9d-%d7%a7%d7%98%d7%a0%d7%99%d7%9d-%d7%91%d7%9e%d7%a1%d7%9c%d7%95%d7%9c-%d7%9e%d7%94%d7%99%d7%a8-%d7%a2%d7%93-100000/|קרן לסיוע לעסקים קטנים
https://loan-israel.co.il/Business/track-assistance-to-set-up-plants-in-israel-causing-a-change-in-the-periphery/|מסלול סיוע להקמת מפעלים מחוללי שינוי בפריפריה בישראל
https://loan-israel.co.il/Business/tracks-loans-businesses-bank-yahav/|הלוואות לעסקים של בנק יהב לעובדי המדינה
https://loan-israel.co.il/Business/business-loans-routes-pagi-bank/|מסלולי הלוואות לעסקים של בנק פועלי אגודת ישראל
https://loan-israel.co.il/Business/business-crisis-loans/|הלוואות בערבות מדינה לעסקים במשבר
https://loan-israel.co.il/Business/%d7%a7%d7%a8%d7%9f-%d7%94%d7%96%d7%a0%d7%a7-%d7%a9%d7%9c-%d7%94%d7%9e%d7%93%d7%a2%d7%9f-%d7%94%d7%a8%d7%90%d7%a9%d7%99/|קרן הזנק, קרן הזנק רשות החדשנות
https://loan-israel.co.il/Business/small-business-loan-fund/|הלוואות לעסקים קטנים
https://loan-israel.co.il/Business/%d7%a7%d7%a8%d7%9f-%d7%94%d7%92%d7%9c%d7%99%d7%9c/|קרן הגליל
https://loan-israel.co.il/Business/%d7%a4%d7%a8%d7%95%d7%99%d7%a7%d7%98%d7%99%d7%9d-%d7%95%d7%9e%d7%9b%d7%a8%d7%96%d7%99%d7%9d-%d7%91%d7%99%d7%9f-%d7%9c%d7%90%d7%95%d7%9e%d7%99%d7%99%d7%9d/|קרן לסיוע לפרויקטים ומכרזים בין לאומיים
https://loan-israel.co.il/Business/%d7%a7%d7%a8%d7%9f-%d7%93%d7%98%d7%a8%d7%95%d7%99%d7%98/|קרן דטרויט
https://loan-israel.co.il/Business/financing-rental-properties/|מימון נכסים מניבים
https://loan-israel.co.il/Business/farmers-assistance-fund/|קרן סיוע לחקלאים
https://loan-israel.co.il/Business/state-aid-funding-and-allocation-of-land/|סיוע ממשלתי במימון והקצאת קרקעות
https://loan-israel.co.il/Business/trade-relief-fund/|קרן סיוע למסחר
https://loan-israel.co.il/Business/loans-for-the-purchase-of-equipment-and-machinery/|הלוואות לרכישת ציוד ומכונות
https://loan-israel.co.il/Business/medium-business-loans/|הלוואות בערבות מדינה לעסקים בינוניים
https://loan-israel.co.il/Business/veteran-business-loan/|הלוואות בערבות מדינה לעסק ותיק
https://loan-israel.co.il/Business/exempt-dealer/|הלוואה לעוסק פטור
https://loan-israel.co.il/Business/credit-recruitment-for-real-estate/|גיוס אשראי לעסקאות נדלן
https://loan-israel.co.il/Business/%d7%94%d7%a7%d7%a8%d7%9f-%d7%9c%d7%a2%d7%95%d7%9c%d7%94-%d7%94%d7%a2%d7%a6%d7%9e%d7%90%d7%99/|הקרן לעולה העצמאי
https://loan-israel.co.il/Business/commercial-property-financing/|מימון נכס מסחרי
https://loan-israel.co.il/Business/financing-real-estate-transactions/|מימון עסקאות נדל"ן
https://loan-israel.co.il/Business/business-loans-of-treasury-bank-otzar-hachayal/|הלוואות לעסקים של בנק אוצר החייל
https://loan-israel.co.il/Business/tracks-loans-businesses-of-bank-massad/|הלוואות לעסקים של בנק מסד
https://loan-israel.co.il/Business/expanding-business-loan/|הלוואה בערבות המדינה להרחבת העסק
https://loan-israel.co.il/Business/%d7%a7%d7%a8%d7%9f-%d7%93%d7%a8%d7%95%d7%9e%d7%94-%d7%a6%d7%a4%d7%95%d7%a0%d7%94/|קרן דרומה צפונה לעסקים
