URL|מילות מפתח
https://loan-israel.co.il/Business/%d7%94%d7%9c%d7%95%d7%95%d7%90%d7%94-%d7%91%d7%a2%d7%a8%d7%91%d7%95%d7%aa-%d7%94%d7%9e%d7%93%d7%99%d7%a0%d7%94-%d7%91%d7%a2%d7%a7%d7%91%d7%95%d7%aa-%d7%9e%d7%9c%d7%97%d7%9e%d7%aa-%d7%97%d7%a8%d7%91/|הלוואה בערבות המדינה חרבות ברזל
https://loan-israel.co.il/Business/poalim-bank-for-business/|בנק הפועלים לעסקים
https://loan-israel.co.il/Business/%d7%a7%d7%a8%d7%9f-%d7%a9%d7%9e%d7%a9-%d7%9c%d7%99%d7%96%d7%9e%d7%99%d7%9d/|קרן שמש ליזמים
https://loan-israel.co.il/Business/%d7%9e%d7%99%d7%9e%d7%95%d7%9f-%d7%9c%d7%99%d7%96%d7%9e%d7%99%d7%9d-%d7%95%d7%a2%d7%a6%d7%9e%d7%90%d7%99%d7%99%d7%9d-%d7%9e%d7%aa%d7%97%d7%99%d7%9c%d7%99%d7%9d/|מימון ליזמים, מימון ליזמים והלוואה לעצמאים
https://loan-israel.co.il/Business/%d7%a9%d7%99%d7%a8%d7%95%d7%aa%d7%99-%d7%a0%d7%99%d7%9b%d7%99%d7%95%d7%9f-%d7%a6%d7%a7%d7%99%d7%9d/|שירותי ניכיון צ'קים
https://loan-israel.co.il/Business/funding-for-the-construction-and-expansion-of-tourism-projects/|מימון להקמה והרחבה של פרויקטים בתחום התיירות
https://loan-israel.co.il/Business/distressed-enterprises-assistance-funds/|קרנות סיוע למפעלים במצוקה
https://loan-israel.co.il/Business/credit-and-loans-contractors/|הלוואות לקבלנים, אשראי והלוואות לקבלנים
https://loan-israel.co.il/Business/loans-and-credit-recruitment-purchasing-groups/|הלוואות לקבוצות רכישה
https://loan-israel.co.il/Business/loans-to-businesses-of-bank-hapoalim/|הלוואות לעסקים של בנק הפועלים
https://loan-israel.co.il/Business/tracks-loans-businesses-of-bank-of-jerusalem/|הלוואות לעסקים של בנק ירושלים
https://loan-israel.co.il/Business/loans-maof-ministry-of-economy/|הלוואות במסגרת מעוף של משרד הכלכלה
https://loan-israel.co.il/Business/guaranteed-loans-banks/|הלוואה בערבות מדינה מבנקים
https://loan-israel.co.il/Business/entrepreneurs-loan/|הלוואה בערבות מדינה ליזמים
https://loan-israel.co.il/Business/maslol-hon-huzer/|הלוואות בערבות מדינה מסלול הון חוזר
https://loan-israel.co.il/Business/enterprises-and-industry-loans/|הלוואות בערבות המדינה למפעלים, הלוואות בערבות המדינה למפעלים ותעשייה
https://loan-israel.co.il/Business/small-business-loans/|הלוואות בערבות המדינה לעסקים קטנים
https://loan-israel.co.il/Business/%d7%a7%d7%a8%d7%9f-%d7%94%d7%9c%d7%95%d7%95%d7%90%d7%95%d7%aa-%d7%a1%d7%95%d7%9c%d7%9d/|קרן סולם, קרן סולם הלוואות לעסקים במגזר הערבי
https://loan-israel.co.il/Business/%d7%94%d7%9c%d7%95%d7%95%d7%90%d7%94-%d7%9c%d7%97%d7%91%d7%a8%d7%94-%d7%91%d7%a2%d7%9e/|הלוואה לחברה בע"מ
https://loan-israel.co.il/Business/authorized-dealer-loan/|הלוואות לעוסק מורשה
